{
  "manifest_id": "bridge-phase0-initial-authority-source-declaration",
  "revision_policy": "COMMON_SOURCE_REVISION_REQUIRED",
  "common_source_revision": null,
  "freshness_policy_reference": "phase0-policy.json#/freshness_policy",
  "sources": [
    {
      "source_path": "docs/ops/HEDGR_STATUS.md",
      "source_role": "CURRENT_SEQUENCE_AND_ACTIVE_AUTHORITY",
      "requirement": "MANDATORY",
      "source_classification": "REPO_AUTHORITY",
      "expected_revision": null,
      "actual_revision": null,
      "freshness_requirement": "CURRENT_REQUIRED",
      "freshness": "UNKNOWN",
      "structural_validation": "NOT_EVALUATED",
      "stable_locator_support": "REQUIRED",
      "inclusion_status": "NOT_EVALUATED",
      "reason": "Declared for later source-bound loading; Phase 0 does not read it.",
      "conflict_status": "NOT_EVALUATED"
    },
    {
      "source_path": "AGENTS.md",
      "source_role": "REPO_EXECUTION_CONTRACT",
      "requirement": "MANDATORY",
      "source_classification": "REPO_AUTHORITY",
      "expected_revision": null,
      "actual_revision": null,
      "freshness_requirement": "CURRENT_REQUIRED",
      "freshness": "UNKNOWN",
      "structural_validation": "NOT_EVALUATED",
      "stable_locator_support": "REQUIRED",
      "inclusion_status": "NOT_EVALUATED",
      "reason": "Declared for later source-bound loading; Phase 0 does not read it.",
      "conflict_status": "NOT_EVALUATED"
    },
    {
      "source_path": "docs/decisions/SPRINT-2-ADR-INDEX.md",
      "source_role": "ACCEPTED_ADR_INDEX",
      "requirement": "MANDATORY",
      "source_classification": "REPO_AUTHORITY",
      "expected_revision": null,
      "actual_revision": null,
      "freshness_requirement": "CURRENT_REQUIRED",
      "freshness": "UNKNOWN",
      "structural_validation": "NOT_EVALUATED",
      "stable_locator_support": "REQUIRED",
      "inclusion_status": "NOT_EVALUATED",
      "reason": "Declared index; the manifest does not infer that an undisclosed partial ADR set is complete.",
      "conflict_status": "NOT_EVALUATED"
    },
    {
      "source_path": "docs/doctrine/HEDGR_ACTIVE_DOCTRINE_INDEX.md",
      "source_role": "ACTIVE_DOCTRINE_SET_INDEX",
      "requirement": "MANDATORY",
      "source_classification": "REPO_AUTHORITY",
      "expected_revision": null,
      "actual_revision": null,
      "freshness_requirement": "CURRENT_REQUIRED",
      "freshness": "UNKNOWN",
      "structural_validation": "NOT_EVALUATED",
      "stable_locator_support": "REQUIRED",
      "inclusion_status": "NOT_EVALUATED",
      "reason": "Canonical repo-defined doctrine completeness index adopted under BRIDGE-P1-001 R2; the Bridge does not discover or infer membership.",
      "conflict_status": "NOT_EVALUATED"
    }
  ]
}
